Information for device FT260 (VID=0x0403 PID=0x6030):

------------------------------
Connection Information:
------------------------------
Device current bus speed: FullSpeed
Device supports USB 1.1 specification
Device supports USB 2.0 specification
Device address: 0x0002
Current configuration value: 0x01
Number of open pipes: 2


------------------------------
Device Descriptor:
------------------------------
0x12	bLength
0x01	bDescriptorType
0x0200	bcdUSB
0x00	bDeviceClass      
0x00	bDeviceSubClass   
0x00	bDeviceProtocol   
0x40	bMaxPacketSize0   (64 bytes)
0x0403	idVendor
0x6030	idProduct
0x2200	bcdDevice
0x01	iManufacturer   "FTDI"
0x02	iProduct        "FT260"
0x00	iSerialNumber
0x01	bNumConfigurations


-------------------------
Configuration Descriptor:
-------------------------
0x09	bLength
0x02	bDescriptorType
0x0029	wTotalLength   (41 bytes)
0x01	bNumInterfaces
0x01	bConfigurationValue
0x00	iConfiguration
0xA0	bmAttributes   (Bus-powered Device, Remote-Wakeup)
0x32	bMaxPower      (100 mA)

Interface Descriptor:
------------------------------
0x09	bLength
0x04	bDescriptorType
0x00	bInterfaceNumber
0x00	bAlternateSetting
0x02	bNumEndPoints
0x03	bInterfaceClass      (Human Interface Device Class)
0x00	bInterfaceSubClass   
0x00	bInterfaceProtocol   
0x00	iInterface

HID Descriptor:
------------------------------
0x09	bLength
0x21	bDescriptorType
0x0111	bcdHID
0x00	bCountryCode
0x01	bNumDescriptors
0x22	bDescriptorType   (Report descriptor)
0x0117	bDescriptorLength

Endpoint Descriptor:
------------------------------
0x07	bLength
0x05	bDescriptorType
0x81	bEndpointAddress  (IN endpoint 1)
0x03	bmAttributes      (Transfer: Interrupt / Synch: None / Usage: Data)
0x0040	wMaxPacketSize    (1 x 64 bytes)
0x01	bInterval         (1 frames)

Endpoint Descriptor:
------------------------------
0x07	bLength
0x05	bDescriptorType
0x02	bEndpointAddress  (OUT endpoint 2)
0x03	bmAttributes      (Transfer: Interrupt / Synch: None / Usage: Data)
0x0040	wMaxPacketSize    (1 x 64 bytes)
0x01	bInterval         (1 frames)

Microsoft OS Descriptor:
------------------------------
0x04	bLength
0x03	bDescriptorType
Hex dump: 
0x04 0x03 0x09 0x04 


--------------------------------
String Descriptor Table
--------------------------------
Index  LANGID  String
0x00   0x0000  0x0409 
0x01   0x0409  "FTDI"
0x02   0x0409  "FT260"

------------------------------

Connection path for device: 
Texas Instruments USB 3.0 xHCI Host Controller
Root Hub
FT260 (VID=0x0403 PID=0x6030) Port: 1
